*	bg	Forest
*	bgm	Script_Normal
notshown	-	???	저기요오~? 아무도 없어요~?
reina	-	레이나	......!!
reina	-	레이나	(얼마나 지난 거지? 벌써 여기까지 발견된 건가?! 빨리 도망쳐야......)
notshown	-	???	빈집인가? 하긴. 이런 산구석에 덩그라니 민가 하나 있는 것도 이상하지. 신세 좀 지고 가야겠다. 누군지 모르겠지만 복 받으실 거에요!
reina	-	레이나	(......뭐지?)
notshown	-	???	이런 역시 잠겼군. 어쩔 수 없나?
reina	-	레이나	(날 쫓아온 게 아닌가......?)
notshown	-	???	되도록 적은 피해로 문을 부수는 방법이 뭐가 있을ㄲ......
reina	-	레이나	무슨 짓이야!
notshown	-	???	우왁!
blank	-	-	레이나가 급하게 열어젖힌 문에 얼굴을 부딪힌 불청객은 잔뜩 찌푸린 표정으로 은근슬쩍 안으로 걸어들어왔다. 조금 전까지의 생기 넘치는 말투와는 달리 구겨진 옷에 초췌한 얼굴까지 행색이 말이 아니었다.
sisterna	-	???	아야야...... 이런 불연속함수같은 사람을 봤나. 당신 그렇게 살면 미분도 안 된다고요!
reina	-	레이나	뭔 소리야......? 아니 잠깐만, 애초에 남의 건물 문을 부수려 들지 말라고요.....
sisterna	-	???	뭐 아무튼, 그게 중요한 건 아니지. 그런 건 무한으로 가는 1/n의 극한만큼이나 사소한 거니까.
reina	-	레이나	......?
sisterna	-	???	아, 자기소개를 안 했네. 제 이름은 시스터나 레온하르트, 마법물리학 박사죠.
*	adv_start
**	시스터나	-
sisterna	-	시스터나	휴우, 산에서 길을 잃어서 이틀째 헤매고 있었는데 덕분에 신세를 지게 됐네요.
reina	-	레이나	(아직 허락한 기억은 없는데......?)
sisterna	-	시스터나	그쪽은요?
reina	-	레이나	네?
sisterna	-	시스터나	통성명. 제 이름을 말했으면 그쪽도 말해줘야 하는 거 아닌가요?
reina	-	레이나	아, 그, 그런가요. 제 이름은......
reina	-	레이나	(잠깐, 지금 내 이름을 그대로 말하면 안 되잖아? 일단 딴소리를 하면서 주의를 돌려 봐야겠다.)
reina	-	레이나	죄송하지만 아까 정신이 없어서 제대로 못 들었는데, 성함이 어떻게 되신다고요?
sisterna	-	시스터나	시스터나 레온하르트! 마법물리학 박사죠! 자바 연방 공화국에서 왔답니다!
reina	-	레이나	어? 분명 어디서 들어본 것 같은 이름인데...... 잠깐만, 자바? 그렇다면, 자바 마법학계의 이단아라는 그 시스터나 레온하르트!
sisterna	-	시스터나	호오, 그걸 알고 있다면 마법 꽤나 하셨나보네요. 이런 데서 사시더니만 역시 평범한 분은 아니군!
reina	-	레이나	뭐, 그렇죠. 그런데 그 먼 곳에서 왜 여기까지......?
sisterna	-	시스터나	레이나 핀토스 씨를 찾으러 왔어요. 듣기로는 모나폴리에 산다고 하던......!
blank	-	-	그 말을 다 끝내기도 전에 레이나의 손이 재빨리 움직인다. 그녀가 날려 보낸 불덩이가 시스터나의 얼굴에 직격하는 듯했지만, 피어오른 먼지가 걷히고 드러난 모습에서는 머리카락이 조금 그을린 것 이외의 차이를 찾을 수 없었다.
sisterna	-	시스터나	......이게 무슨 짓이죠?
reina	-	레이나	내가 바로 레이나 핀토스니까! 날 잡아서 한몫 챙기고 이 나라에 정착하려고 했던 모양이지만, 상대를 잘못 골랐어.
sisterna	-	시스터나	뭔가 오해가 있었던 모양인데, 잠깐 차분하게 이야기를 하는 게 어때요? 그리고 미리 말하자면, 한 번 더 공격하면 그땐 가만히 안 있을 테니 참고하시고.
blank	-	-	레이나는 그동안 있었던 일을 이야기했다. 연회에서 벌어진 참극, 루키어스 하스켈과의 탈출, 이틀 전에 있었던 아스터 요원과의 교전, 그리고 자신의 현재 목표까지.
blank	-	-	시스터나는 이야기가 진행되는 동안 책장 하나에 기대어 선 채 시시각각 표정을 바꾸며 듣고 있었다. 이틀째 산에서 조난당했다는 사람치고는 꽤나 반응이 풍부한 편이었다.
reina	-	레이나	......미안해요. 요 며칠 너무 신경이 곤두서 있어서.
sisterna	-	시스터나	뭐, 그런 상황이라면 이해 못 할 행동은 아니니까 넘어가도록 하죠. 어쩐지, 오다 보니까 며칠 전 부터 마을에 군인들이 막 돌아다니고 분위기가 뒤숭숭하더라니. 괜히 찔려서 피해 다니고 그랬네.
reina	-	레이나	네? 왜요?
sisterna	-	시스터나	왜긴요? 저 불법체류자거든요. 요즘처럼 양국 관계가 험악한 시기에 국경 통과 허가가 그렇게 쉽게 날 리가 있겠어요?
reina	-	레이나	......좀 많이 돌아갔지만 본론으로 넘어가죠. 무슨 일로 저를 만나려고 한 건데요?
sisterna	-	시스터나	마법 물리학의 가지도 모르는 자바의 마법학계엔 미래가 없고, 마법의 새로운 지평이 지닌 가치를 알아볼 만한 사람으로 가장 적합한 건 당신이라고 생각했기 때문이죠!
sisterna	-	시스터나	결국 모든 것은 사물의 이치, 곧 물리법칙에 의해 움직이는 법. 마법이라는 것도 무에서 유를 만드는 게 아니라 그 궤도를 바꿀 수 있도록 약간의 힘을 가하는 것에 불과하죠.
sisterna	-	시스터나	마법으로 불을 피우는 것도 주변의 열에너지를 작은 부피에 압축해 주변 소재가 발화점에 도달할 때까지 계속하는 것뿐. 그리고 그 불을 만들어낸 후에 그것이 타고 소멸하는 과정도 오로지 물리법칙의 궤도를 따라 진행되고!
sisterna	-	시스터나	여기까지는 다들 이해하죠. 아마 핀토스 씨도 그럴 거고.
reina	-	레이나	아, 네.
sisterna	-	시스터나	결국 이 에테르의 움직임을 정량적으로 계산해서! 더욱 효율적으로 마법을 사용할 수 있도록 하는 게! 마법물리학의! 핵심이죠!
sisterna	-	시스터나	이 얼마나 엄청난 발견인지! 요즘 잘 나가는 부자들이 쓴다는 수정 통신기도 전자기학을 거쳐서 나온 마법물리학의 산물이죠! 덧붙이자면 아까 공격을 막아낸 것도 호신용으로 두르고 다니는 원자의 선 스펙트럼이 @#^$%&$#%......
blank	-	-	처음에는 기본적인 마법 이론을 익힌 사람이라면 누구라도 이해할 수 있을 만한 내용에서 시작했지만, 점점 자신의 이야기에 심취하는 듯하더니 알 수 없는 내용으로 흐르기 시작했다. 명한 표정으로 듣고 있던 레이나는 결국 쏟아지는 말의 홍수에서 틈새를 찾아 비집고 들어갈 수밖에 없었다.
reina	-	레이나	아, 그, 그렇군요. 굉장하네요.
sisterna	-	시스터나	자! 하지 않겠는가!
reina	-	레이나	분명 흥미로운 이야기인데...... 아쉽지만 어울려 줄 수는 없어요.
sisterna	-	시스터나	어, 어째서죠!
reina	-	레이나	평범한 상황이라면 좋은 대화 상대가 될 수 일었을 텐데, 아까 말했듯이 제가 지금 그럴 처지가 아니라서 말이죠. 그럼 이만......
sisterna	-	시스터나	......흥! 그까짓 거 도와주면 되는 거죠?
reina	-	레이나	 네? 뭘요?
sisterna	-	시스터나	뭐긴. 가문이 통째로 숙청당했고 본인은 도망자 신세. 그런데 생존자를 모아서 핀토스 가를 재건하고 싶다, 라면서? 그걸 도와주면 되는 거 아닌가요?
reina	-	레이나	......그 말은 유니티 제국의 황제와 대립하겠다는 뜻이에요. 괜히 남의 나라까지 넘어와서 허무하게 인생마감할지도 모르는데?
sisterna	-	시스터나	상관없어요. 어차피 언젠가는 죽는 게 인생인데 화끈하게 불태워보는 것도 나쁘지 않고.
reina	-	레이나	(어, 엄청난 사람이군......)
reina	-	레이나	(어쨌든 적은 아닌 것 같고, 본인이 좋다고 하니 되는 데까지는 이용해보도록 할까. ......'의무'를 위해서.)
**	출구	-
sisterna	-	시스터나	그럼 이제 뭘 해야하죠?
reina	-	레이나	핀토스의 생존자들을 찾아서 뭉쳐야 해요.
blank	-	-	레이나는 기록 보관소의 한쪽 구석을 차지하고 있는 거대한 수정 통신기를 가리켰다.
reina	-	레이나	그러려면 저걸로 신호를 보내야 하죠.
sisterna	-	시스터나	허억?! 크기가 무슨......! 저 정도면 대륙 끝에서 반대편 끝까지도 닿겠네!
reina	-	레이나	어쩌면 될지도 모르겠네요. 시도해 본 적은 없지만.
sisterna	-	시스터나	어쨌든, 그러면 신호를 보내면 되는 거 아닌가요?
reina	-	레이나	아까 해 봤는데, 제대로 작동하지 않는 걸로 봐서 새로운 수정을 공급해줘야 할 것 같더군요. 저만한 크기를 인간의 체내 에테르만으로 돌릴 순 없으니.
sisterna	-	시스터나	흐음, 그렇군요. 하지만 당장 어디 가서 구해오죠?
reina	-	레이나	그건 따라오시면 알게 될 테니 걱정 마시죠.
*	load_script	pintos#7-2